{
  "schema_version": "1.0.0",
  "generated_at_utc": "2026-10-15T18:17:59.426582+00:00",
  "purpose": "offline_source_observations",
  "inspection_summary": {
    "status": "complete",
    "expected_file_count": 5,
    "profiled_file_count": 5,
    "fully_inspected_file_count": 5,
    "meaning": "completion_of_requested_profile_scope_not_source_qualification"
  },
  "qualification": {
    "status": "unresolved",
    "physical_validity_labels_available": false,
    "independent_sources_combined": false,
    "source_labels_meaning": "research_labels_not_command_safety_ground_truth",
    "open_items": [
      "provenance",
      "redistribution_rights",
      "units",
      "sign_conventions",
      "time_alignment",
      "experiment_groups",
      "approved_operating_constraints"
    ]
  },
  "sources": [
    {
      "source_id": "S1",
      "role": "primary_command_context_candidate",
      "record": "https://doi.org/10.5281/zenodo.15373938"
    },
    {
      "source_id": "S2",
      "role": "independent_optional_pv_fault_context",
      "record": "https://doi.org/10.17632/n76t439f65.1"
    },
    {
      "source_id": "S3",
      "role": "independent_optional_microgrid_context",
      "record": "https://doi.org/10.34810/DATA2936"
    }
  ],
  "files": [
    {
      "source_id": "S1",
      "filename": "logs_dataset.parquet",
      "format": "parquet",
      "inspection_complete": true,
      "size_bytes": 123121,
      "sha256": "5ea386a66b4ee5c0c5602f3e70e6c118d6d5e208cabf0d99e9c4110b84e4352d",
      "md5": "28b94fef326526f46df96402be80e149",
      "publisher_identity": {
        "record": "https://zenodo.org/records/15373938",
        "algorithm": "md5",
        "expected": "28b94fef326526f46df96402be80e149",
        "matches": true,
        "meaning": "byte_identity_only_not_data_qualification"
      },
      "profile": {
        "row_count": 6459,
        "scanned_row_count": 6459,
        "row_group_count": 1,
        "column_count": 7,
        "scan": {
          "scope": "all_rows",
          "batch_rows": 8192,
          "row_sampling": false,
          "raw_rows_emitted": 0
        },
        "columns": [
          {
            "name": "server_recv_ts",
            "arrow_type": "timestamp[ns, tz=+01:00]",
            "nullable": true,
            "null_count": 0,
            "non_null_count": 6459,
            "time_range": {
              "min": "2025-02-19 03:08:34.106661000+0100",
              "max": "2025-02-19 07:00:06.161340000+0100"
            },
            "timezone": "+01:00"
          },
          {
            "name": "device_ts",
            "arrow_type": "timestamp[ns]",
            "nullable": true,
            "null_count": 0,
            "non_null_count": 6459,
            "time_range": {
              "min": "2015-05-18 17:27:12.804000000",
              "max": "2015-05-18 21:24:06.717000000"
            },
            "timezone": null
          },
          {
            "name": "hostname",
            "arrow_type": "dictionary<values=string, indices=int8, ordered=0>",
            "nullable": true,
            "null_count": 0,
            "non_null_count": 6459,
            "categories": {
              "counts": {
                "PLC_SECCPU12": 1479,
                "PLC_SECCPU16": 4980
              },
              "max_categories": 64,
              "overflow_value_count": 0,
              "scope": "all_rows",
              "meaning": "source_observation_not_physical_validity"
            }
          },
          {
            "name": "field_name",
            "arrow_type": "dictionary<values=string, indices=int8, ordered=0>",
            "nullable": true,
            "null_count": 0,
            "non_null_count": 6459,
            "categories": {
              "counts": {
                "Actual_Charge_Power": 483,
                "OnOff": 4449,
                "Target_Charge_Power": 386,
                "Poa_direct": 381,
                "Poa_diffuse": 333,
                "Inverter_ac_power": 105,
                "Inverter_dc_power": 102,
                "Cell_Temperature": 193,
                "Temp_Air": 27
              },
              "max_categories": 64,
              "overflow_value_count": 0,
              "scope": "all_rows",
              "meaning": "source_observation_not_physical_validity"
            }
          },
          {
            "name": "old_value",
            "arrow_type": "double",
            "nullable": true,
            "null_count": 0,
            "non_null_count": 6459,
            "numeric": {
              "finite_count": 6459,
              "nonfinite_count": 0,
              "min": -0.6,
              "max": 65506.0,
              "mean": 2671.40027868091
            }
          },
          {
            "name": "new_value",
            "arrow_type": "double",
            "nullable": true,
            "null_count": 0,
            "non_null_count": 6459,
            "numeric": {
              "finite_count": 6459,
              "nonfinite_count": 0,
              "min": -0.6,
              "max": 65506.0,
              "mean": 2673.458879083449
            }
          },
          {
            "name": "__index_level_0__",
            "arrow_type": "int64",
            "nullable": true,
            "null_count": 0,
            "non_null_count": 6459,
            "numeric": {
              "finite_count": 6459,
              "nonfinite_count": 0,
              "min": 0,
              "max": 6458,
              "mean": 3229.0
            }
          }
        ],
        "qualification": "units_sign_conventions_time_alignment_and_experiment_groups_unresolved"
      },
      "status": "profiled"
    },
    {
      "source_id": "S1",
      "filename": "packets_dataset.parquet",
      "format": "parquet",
      "inspection_complete": true,
      "size_bytes": 201835803,
      "sha256": "5121f480c174f845d243560e8f112ea2ba43dc2922a9f563309cd7c10166ead2",
      "md5": "ebbdee3de97e25cf4020d8552f431762",
      "publisher_identity": {
        "record": "https://zenodo.org/records/15373938",
        "algorithm": "md5",
        "expected": "ebbdee3de97e25cf4020d8552f431762",
        "matches": true,
        "meaning": "byte_identity_only_not_data_qualification"
      },
      "profile": {
        "row_count": 10002790,
        "scanned_row_count": 10002790,
        "row_group_count": 10,
        "column_count": 5,
        "scan": {
          "scope": "all_rows",
          "batch_rows": 8192,
          "row_sampling": false,
          "raw_rows_emitted": 0
        },
        "columns": [
          {
            "name": "timestamp",
            "arrow_type": "timestamp[ns]",
            "nullable": true,
            "null_count": 0,
            "non_null_count": 10002790,
            "time_range": {
              "min": "2025-02-19 01:59:44.229999000",
              "max": "2025-02-19 05:59:32.675575000"
            },
            "timezone": null
          },
          {
            "name": "packet",
            "arrow_type": "binary",
            "nullable": true,
            "null_count": 0,
            "non_null_count": 10002790
          },
          {
            "name": "label",
            "arrow_type": "string",
            "nullable": true,
            "null_count": 0,
            "non_null_count": 10002790,
            "categories": {
              "counts": {
                "normal": 9991107,
                "data_modification": 11683
              },
              "max_categories": 64,
              "overflow_value_count": 0,
              "scope": "all_rows",
              "meaning": "source_observation_not_physical_validity"
            }
          },
          {
            "name": "datamod_changes",
            "arrow_type": "string",
            "nullable": true,
            "null_count": 9991107,
            "non_null_count": 11683
          },
          {
            "name": "s7_datablock",
            "arrow_type": "binary",
            "nullable": true,
            "null_count": 9673817,
            "non_null_count": 328973
          }
        ],
        "qualification": "units_sign_conventions_time_alignment_and_experiment_groups_unresolved"
      },
      "status": "profiled"
    },
    {
      "source_id": "S1",
      "filename": "process_dataset.parquet",
      "format": "parquet",
      "inspection_complete": true,
      "size_bytes": 359657,
      "sha256": "163613e85346c8913e423014e9c8911a3407dab2456cc10819e6ee9dad2ee7d8",
      "md5": "ebc3e048e0319f044ea47cc08e498999",
      "publisher_identity": {
        "record": "https://zenodo.org/records/15373938",
        "algorithm": "md5",
        "expected": "ebc3e048e0319f044ea47cc08e498999",
        "matches": true,
        "meaning": "byte_identity_only_not_data_qualification"
      },
      "profile": {
        "row_count": 13912,
        "scanned_row_count": 13912,
        "row_group_count": 1,
        "column_count": 22,
        "scan": {
          "scope": "all_rows",
          "batch_rows": 8192,
          "row_sampling": false,
          "raw_rows_emitted": 0
        },
        "columns": [
          {
            "name": "archive_recv_ts",
            "arrow_type": "timestamp[ns]",
            "nullable": true,
            "null_count": 0,
            "non_null_count": 13912,
            "time_range": {
              "min": "2025-02-19 02:07:14.956493832",
              "max": "2025-02-19 06:00:12.745930709"
            },
            "timezone": null
          },
          {
            "name": "in_pv_temp_air",
            "arrow_type": "double",
            "nullable": true,
            "null_count": 0,
            "non_null_count": 13912,